Title,Description,Region,Organisation Name,estimated_cost,final_cost,overshot
RA351800 - Chichester College- Composites equipment,Chichester College Composites equipment as per requirements in separate attachment - looking for delivery by end of July where possible - To access this competition: login to https://suppliers.multiquote.com and view the opportunity RA351800. Not registered on MultiQuote - visit https://suppliers.multiquote.com then register and quote RA351800 as the reason for registration. Any queries please contact MultiQuote on 0151 482 9230.,Any region,Chichester College Group,0,0,0
CWC23084 Task 3 - Reedham Gardens via Framework Call Off from Wolverhampton Housing Development Framework,"Construction of seventeen new build properties  comprising of nine 3 bedroom and four 2 bedroom houses, two 2 bedroom and two 1 bedroom bungalows with associated infrastructure.",West Midlands,Wolverhampton City Council,4677312,4677312,0
Arboricultural services - Tree works operations,"13545 ESTATE AD-HOC 120425 300525
Ad hoc tree works borough wide estates This opportunity has been distributed on adamprocure.co.uk",United Kingdom,London Borough Of Islington,0,0,0
RA351688 - Peer-Supported Open Dialogue Trainer Role (Tutor),"The project scope involves conducting the general roles of a tutor in peer-supported Open Dialogue, but also adding to it the international experience of delivering an Open Dialogue service in an international context. 
The project therefore involves delivering a training to the unique context of the UK NHS, but also, bringing to that, an awareness of permutations that exists in other countries and how neighbouring nations, like Ireland have managed and implemented the model. 
 - To access this competition: login to https://suppliers.multiquote.com and view the opportunity RA351688. Not registered on MultiQuote - visit https://suppliers.multiquote.com then register and quote RA351688 as the reason for registration. Any queries please contact MultiQuote on 0151 482 9230.",Any region,North East London NHS Foundation Trust,0,0,0
RA351685 - Peer-Supported Open Dialogue Trainer Role (Tutor 2),"The delivery of the Open Dialogue training as a tutor, with a special consideration on trauma therapies such as EMDR and the integration of these different psychological modalities, as well as systemic practice, into Open Dialogue.
The scope of this project therefore integrates a combination of teaching Open Dialogue to trainees with a wider awareness of how pertinent specialist interventions can enhance treatment and improve outcomes for both patients and their families and networks.
 - To access this competition: login to https://suppliers.multiquote.com and view the opportunity RA351685. Not registered on MultiQuote - visit https://suppliers.multiquote.com then register and quote RA351685 as the reason for registration. Any queries please contact MultiQuote on 0151 482 9230.",Any region,North East London NHS Foundation Trust,0,0,0
RA351678 - Peer-Supported Open Dialogue Trainer Role (Lived Experience Tutor),"The incorporation of the lived experience lens into the design and delivery of the NELFT Open Dialogue training. This is both a general and specific role. In general it involves fulfilling the work of course tutor, with a tutor group to support, but specifically also to teach and provide support around the lived experience aspect of Peer-supported Open Dialogue.
The scope therefore is an extensive one, including leadership of the peer aspect and delivering overall support and guidance and a reflective space for peers and those with lived experience on the training who would benefit from such a focus.
 - To access this competition: login to https://suppliers.multiquote.com and view the opportunity RA351678. Not registered on MultiQuote - visit https://suppliers.multiquote.com then register and quote RA351678 as the reason for registration. Any queries please contact MultiQuote on 0151 482 9230.",Any region,North East London NHS Foundation Trust,0,0,0
RA351675 - Peer-Supported Open Dialogue Trainer Role (Development),"The delivery of Open Dialogue training and liaison with the Association of Family Therapists in order to maintain the dialogue around accreditation and any other forms of liaison and accreditation that may assist in the development and roll out of the NELFT Open Dialogue training.
The project work therefore involves a combination of supporting the development and inclusion of systemic thinking into the course and also acting as a bridge between this course and the professional body for Family Therapy in the UK, as well as supporting the training more widely.
 - To access this competition: login to https://suppliers.multiquote.com and view the opportunity RA351675. Not registered on MultiQuote - visit https://suppliers.multiquote.com then register and quote RA351675 as the reason for registration. Any queries please contact MultiQuote on 0151 482 9230.",Any region,North East London NHS Foundation Trust,0,0,0
RA351674 - Peer-Supported Open Dialogue Trainer Role (Coordinator),"The specialist organisation of a niche training, Open Dialogue. This includes maintaining and utilising connections with Open Dialogue specialists and trainers around the world, inviting and assisting their arrival in the UK to contribute to the NELFT Open Dialogue training and working with the course tutors to help with the design, scheduling and delivery of the training itself. - To access this competition: login to https://suppliers.multiquote.com and view the opportunity RA351674. Not registered on MultiQuote - visit https://suppliers.multiquote.com then register and quote RA351674 as the reason for registration. Any queries please contact MultiQuote on 0151 482 9230.",Any region,North East London NHS Foundation Trust,0,0,0
Service & Maintenance of Lifts & Disabled Access Hoists,"** UPDATE: THIS OPPORTUNITY IS CLOSED AS AN ALTERNATIVE PROCUREMENT ROUTE WAS CHOSEN.**

Buckinghamshire New University will be tendering the service contract for the maintenance of lifts & disabled access hoists across it's campuses, halls of residence & conference centre. 

The University will require a minimum of 6 (six) service visits for lifts & 2 (two) visits for disabled access hoists per year per site. The successful contractor will be invited to enter a contract for an initial 3 (three) year period beginning on 1st August 2025 with the option of an extension for a further period of up to 2 (two) years at yearly intervals subject to review of the continued successful performance of the contract. The decision of whether to take up the extension option will be at the absolute discretion of the University. 

The estimated total value of the contract over its duration (including the extension option if this is taken) is £140,000 - £160,000 excluding VAT. 

Suppliers who would like to take part in this tender process are invited to express interest here: https://in-tendhost.co.uk/bucksnewuni/aspx/Home",,Buckinghamshire New University,140000,160000,1
GB-London: New Museum - Food and Beverage,"NOTE: This notice was updated on 17 June 2025 for the following reason: UPDATE:  This addendum is to provide an update to the original deadline for expressions of interest.  Please note the deadline for expressions of interest is now 09.00 am, Monday 30 June 2025.
      
      As a reminder, any interested party should download the relevant documentation via the Museum's Delta platform to review relevant details and instructions pertaining to this opportunity.  Any interested party will be expected to complete and upload a short questionnaire as described in the tender pack available for download.
      A summary of the opportunity can also be found via the following Museum page - (https://www.londonmuseum.org.uk/smithfield/catering/)(This procurement exercise is for the award of a cafe/restaurant/catering concession on behalf of London Museum Trading Limited.  This concession will be located across spaces in the General Market at London Museum's site at Smithfield, currently being developed as part of the Museum's New Museum Project.
      The first stage of this procurement process will be a pre-qualification stage where we are asking interested parties to submit expressions of interest via responses to our pre-selection questionnaire.  Suitable applicants will be shortlisted for a further competition stage with the overall process expected to conclude around October 2025.  Interested applicants MUST register as a supplier on the Delta e-sourcing platform in order to download relevant procurement documents and compile and submit a response for consideration.  Registration is simple and free of charge.
      All detail relating to the opportunity and procurement process will be available to download via the Delta platform once interested parties have successfully registered.  Any queries regarding this opportunity should be submitted via the message centre through the Delta platform as the Museum cannot guarantee sight of queries by other means.
      London Museum Trading Limited reserves the right to amend, cancel and/or not award any potential contract at the end of this process and will not be obliged to reimburse any costs whatsoever.  The company may decide to extend the scope of this concession in the event it proves to be economical to do so.
      London Museum Trading Limited is a registered company (Company No: 05423292).  This procurement is being advertised via Contracts Finder to encourage market interest.
      
      Procurement Documents available for download will comprise of the following:
      A. Procurement Guidance Document (this document)
      B. F&B Information Pack PQQ (detail of the overall opportunity - only released upon
      receipt of signed NDA)
      C. Food and Beverage Tender Approach (detail of the specifics of the contract in question)
      D. Pre-Qualification Questionnaire Overview
      E. Pre-Qualification Questionnaire - Lead Operator (for submission)
      F. Pre-Qualification Questionnaire - Independent Partner (for submission)
      G. Non-Disclosure Template
      
      All details and instructions related to this opportunity are included in these documents.  We request that these are read thoroughly so applicants understood both the requirements of the intended the contract and the process by which to express an interest and participate.)",London,London Museum Trading Limited,5000000,10000000,1
WBCSEN187 - Highwood Primary School,SEN home to school transport,United Kingdom,Wokingham Borough Council,10260,85500,1
TC067 - Provision of Transportation for Officers and Members,"The purpose of this tender is to provide a framework for the provision of Transportation Services for officers and members as and when required for use by Manchester City Council. The framework will consist mainly of low mileage journeys usually within the geographical spread of the City Council's boundaries, or outside of these boundaries if so, required on the basis of either a single or return journey.","North East,North West,Yorkshire and The Humber,East Midlands,West Midlands,East of England,London,South East,South West",Manchester City Council,2400000,2400000,0
CMI Level 7 Apprenticeship Cohort,CMI Level 7 Apprenticeship Cohort,England,Halton Borough Council,98000,98000,0
Emergency Response and medical treatment service,"Sizewell C (SZC) a new nuclear power station under development in Suffolk, is a copy of Hinkley Point C (HPC).  A success at HPC has been the implementation of a Nurse Led Occupational Health Service (Hinkley Health) accessible to everyone engaged in the construction of the HPC build. A similar Health Service (Sizewell Health) is to be set up at SZC, building upon the experience, success, lessons learned and best practice of Hinkley Health. 
      Sizewell Health will work to reduce the ask on local health services that a mainly itinerant workforce could bring, such that there is the minimum impact for these. The service will also work with local educational institutions to support the education and development of students in a variety of health courses throughout the lifetime of the project, with onsite placements and mentorship of students, also engaging on courses delivering real life experience in the lecture theatre setting, on working within Construction / Occupational Healthcare to a possible future workforce.
      The requirement will see a progressive increase in scope of service, resource & supporting infrastructure commensurate with the workforce profile and corresponding site/programme activities. The Occupational Health (OH) provision of Sizewell Health is being undertaken by a different health provider, requiring close and good working relationships to ensure the smooth running of the entire service.
      The health service will be structured around managing the health of the construction worker with a three-tier approach encapsulating the worker, the workplace and wellbeing - Prevention of Ill Health, Fitness to Work and a Treatment Service.
      The service provider will be innovative in the services it provides,working closely with SZC Occupational Health and Wellbeing Manager. Treatment and services to be offered on-site will include but not be limited to:
      -	First Aid and First Responder Emergency Care Level 3 (FREC3) (or similar) training 
      -	an expanding drop in, nurse led treatment service for minor injuries and illnesses 
      -	proportionate GP provision 
      -	provision of commonly prescribed medication. 
      -       24/7 GP telephone service
      -	confidential health advice relating to work or non-work-related health issues (including sexual health and substance misuse). 
      -	Other Clinical services as required.
      -	collation of data on accidents and cases of ill health.
      - 	Emergency response capability across the main construction site and transfer to local NHS hospitals if required, working closely with East of England Ambulance Service Trust (EEAST) to ensure a seamless handover of patients.
      -	Procurement of all equipment required to run this service as it becomes established charged to Sizewell Health so that this becomes the property of Sizewell Health.
      - 	accessible and useable IT system, to maintain health records in accordance with legislative requirements, satisfying all requirements around DPIA and cyber security","London,East of England,South East",Sizewell C Limited,5000000,10000000,1
Arboricultural services - Tree works operations,"13552 HWYS Tufnell Pk Fell & Prune 2526
General Maintenance for Highway Trees This opportunity has been distributed on adamprocure.co.uk",United Kingdom,London Borough Of Islington,0,0,0
Invitation to Tender: Extension to Sports Changing Facility,Extension to Changing Facilities to Provide Additional Storage Area.,South West,Fremington Parish Council,200000,250000,1
Manchester International Airport Platform Remodelling - Temporary Works Design,"The planned introduction of longer train services to the Airport in response to future demand growth will mean that double stacking arrangements of trains as currently used will no longer be viable. Through the project's Delivery Steering Group, Northern and TransPennine Express have carried out analysis which has identified that additional platform capacity is needed at the airport in order to realise the full benefit of longer train services serving the airport.
      
      The scheme is part of a package of proposed measures in the Manchester area that are being designed/planned to boost capacity and resilience, emanating from the Cross Manchester Capacity and Reliability Improvement Study. Improving the operation of train services in the centre of Manchester and providing further capacity at Manchester Airport station, aligns with the strategic aims of Network Rail, TfGM, TfN and the wider industry.  This project in in Tranche 1 of the Manchester and North West Transformation Programme (MNTP):
       
      A remodelling of the station at Manchester Airport, specifically a platform addition or extension of multiple platforms, or provision of a new turnback facility, will be essential to accommodate the planned implementation of longer rolling stock services.
           
      The redevelopment of these platforms will enable permissive working of two 6x24m (144m) trains, in two of the four platforms at the Airport Station. This will allow for the unaltered retention of all existing TOC services both originating and terminating at the Airport Station under 'double-stacking' conditions.
      
      The scope areas for this package are as follows:
      - Main Compound - Fencing, Cabins, Storage
      - Site Access/Diversion Routes
      - Temporary Bridge System
      - Piling
      - Bonding
      - Crane Access/Foundation
      - Scaffold/Propping
      - Drainage","North West,Any region",Kier Transportation - CP7 NWC,100000,150000,1
CERTIFICATE IN SYSTEMIC PRACTICE TRAINING,The delivery of  Certificate in Systemic Practice Training,England,London Borough of Hackney,99000,99000,0
National Attendance & Behaviour Ambassadors,"The DfE is seeking individuals with an excellent understanding of improving and sustaining high standards for attendance and behaviour in schools; a clear understanding of the school system and the associated national policy challenges and opportunities; and the ability to build relationships and communicate credibly with education leaders around the country.

Ambassadors will be sector-facing leaders who promote the importance of school attendance and behaviour and the government's activity in these areas. They will support the DfE in developing effective national attendance and behaviour policy and provide strategic oversight to the Government's Attendance and Behaviour Hubs programme.
The National Attendance and Behaviour Ambassadors will support the DfE's attendance agenda; including by supporting schools to make best use of their data and by championing effective school/trust practice.

They will support the DfE's agenda on behaviour, including promoting a culture of belonging and safety in school for pupils and staff.

Ambassadors shall use all reasonable endeavours to achieve the following aims:

Act as a credible voice, in the education sector, to advocate for Government policy on attendance and behaviour and the implementation of an inclusive approach to mainstream education, including through engagement with schools, Multi-Academy Trusts and others in the education sector.

Support the DfE, including Regional Improvement for Standards and Excellence (RISE) teams; to develop the Attendance and Behaviour Hubs programme to support schools that need help with their attendance and/or behaviour practice.

Support the DfE's wider attendance agenda by reducing variation in school practice between the strongest and weakest schools and helping schools and responsible bodies to meet the statutory expectations and make effective and targeted use of their attendance data.

Support the aims of the DfE's behaviour agenda which includes promoting a culture of belonging and safety in school for pupils and staff.",England,Department For Education,48000,96000,1
FDIS - Weeton External Wall Insulation to 25 properties - FY2025/26 - Amey North Region - Northern England,"Brief Scope of Works
•	EWI to 25 no main dwellings
•	Replace D&W to main dwellings and single storey extensions
•	Reroofing to main dwelling and flat roofs
•	Chimney demolition
•	Gable extensions
•	Replace fascias/soffits/RWGs
•	New lintels to ground floor windows
•	New GRP monopitch canopies
•	Meter over boxes
•	Replace ext lights/doorbells
•	Render outhouse stores & adjoining boundary walls
•	Replace store D&W
•	Replace store roofs/fascias
•	Alterations to fencing/gates for EWI/render installation
•	Itemised boiler replacement
•	Dedicated full time OSLO
Amey have been tasked by the DIO through the FDIS to deliver the RAMS for the North Region.
This notice is a call for competition and there may not be a further notice related to this opportunity.
For Amey to accept any EoI it is ESSENTIAL that any subcontractor is:
•	willing to act as Main Contractor (essential requirement);
•	a Verified member of Constructionline (GOLD), relevant Work Category MUST show that Subcontracting is possible;
•	capable of working to MOD SFG20 (PPM works only);
•	capable of working in a BIM Level 2 environment (where applicable);
•	compliant with DefStan 05-138 (required if you are likely to handle MoD Identifiable Information on your IT system);
•	willing to work with ADS to deliver SV to our Client; ideally, complete the Social Value Goal within the Constructionline platform.
DESIRABLE attributes of our Supply Chain:
•	have a CSR policy;
•	have a Business Continuity and Disaster Recovery Plan
If successful the subcontractor will need to pass a PQQ, sign ADS T&C, and meet the MoD Security Requirements. 
This future opportunity notice is for Expressions of Interest, BY EMAIL ONLY. 
Procurement Documentation will follow separately via a link from our e-tender portal (Curtis Fitch).
Note 1: Bidders must quote for all aspects of the Works
Note 2: Future works may be negotiated based upon submitted rates
Note 3: Those making an Expression of Interest will be required to sign-up to our 'Sub-contract Agreement' where 'Mini Competitions' or 'Call Offs' will be used to tender works/services
Note 4: For complex projects such as EWI installation, Structural works etc. the bidder must (at Contract Award) carry PI Insurance cover of not less than £1,000,000.
Note 5: Those making an EoI will be assessed in accordance with the Public Contract Regulations 2015 i.e. Regulations 57, 58 & 60. ADS expressly reserves the right to require those making an EoI to provide additional information supplementing or clarifying any of the information requested. 
Note 6: Depending on Amey's annual spend with individual bidders you may be required to either have committed to the Science Based Targets Initiative (SBTi), set SBTi approved near-term targets, or Net Zero targets. 
This opportunity is advertised on Constructionline. 
ADS does not bind itself to accept any tender and is not liable for any costs incurred by those expressing an interest or tendering for this opportunity.",North West,AMEY DEFENCE SERVICES LIMITED,870000,4500000,1
FDIS - Haverfordwest Refurbishment of 120 properties - FY2025/26 - Amey Central Region - West,"Central Region - West
Brief Scope of Works
•	Replacement of windows
•	Replacement of main entrance doors
•	Replacement secondary entrance doors (where applicable)
•	Replacement timber personnel garage doors with PVCu doors
•	Replace mains electric doorbells (requires electrician, plasterer and decorator to make good the walls)
•	On Site Liaison Officer role

Amey have been tasked by the DIO through the FDIS to deliver the Regional Accommodation Maintenance Service for the Central and North Regions.

This notice is a call for competition and there may not be a further notice related to this opportunity.

For Amey to accept any EoI it is ESSENTIAL that any subcontractor is:
•	willing to act as Main Contractor (essential requirement);
•	a Verified member of Constructionline (GOLD), relevant Work Category MUST show that Subcontracting is possible;
•	capable of working to MOD SFG20 (PPM works only);
•	capable of working in a BIM Level 2 environment (where applicable);
•	compliant with DefStan 05-138 (required if you are likely to handle MoD Identifiable Information on your IT system);
•	willing to work with Amey to deliver Social Value to our Client; ideally, complete the Social Value Goal within the Constructionline platform.

DESIRABLE attributes of our Supply Chain:
•	have a Corporate Social Responsibility policy;
•	have a Business Continuity and Disaster Recovery Plan
If successful the subcontractor will need to pass a PQQ, sign up to Amey Terms and Conditions, and meet the MoD Security Requirements. 

This future opportunity notice is for Expressions of Interest, BY EMAIL ONLY. 

Procurement Documentation will follow separately via a link from our e-tender portal (Curtis Fitch).

Note 1: The bidder must quote for all aspects of the Works.
Note 2: Future works of a similar nature may be negotiated based upon submitted rates.
Note 3: Those making an Expression of Interest will be required to sign-up to our 'Sub-contract Agreement' where 'Mini Competitions' or 'Call Offs' will be used to tender works/services.
Note 4: For complex projects such as External Wall Insulation installation, Structural works etc. it is a requirement that the bidder must (at Contract Award) carry PI Insurance cover of not less than £1,000,000.
Note 5: Those making an EoI will be assessed in accordance with the Public Contract Regulations 2015 i.e. Regulations 57, 58 & 60. ADS expressly reserves the right to require those making an EoI to provide additional information supplementing or clarifying any of the information requested. 
Note 6: Depending on Amey's annual spend with individual bidders you may be required to either have committed to the Science Based Targets Initiative (SBTi), set SBTi approved near-term targets, or Net Zero targets. 

This opportunity is also advertised on Constructionline. 

ADS does not bind itself to accept any tender and is not liable for any costs incurred by those expressing an interest or tendering for this opportunity.",Wales,AMEY DEFENCE SERVICES LIMITED,870000,4500000,1
