Title,Description,Region,Organisation Name,estimated_cost,final_cost,overshot
Sizewell C Site Establishment - North plaza,"This expression of interest (EOI) serves to inform the supply chain about the upcoming North Plaza construction works scope. 
      Sizewell C (SZC) requires a contractor to construct the North Plaza, a vital component for improving access to the Temporary Construction Area (TCA) and supporting the delivery of the Sizewell C power station. The Entrance Plaza is located to the east of Abbey Road and comprises a network of roads and durable surfaces designed to support access to the TCA. The features of this plaza will include;  
        
      - An external bus interchange, providing efficient connectivity for regional transportation.   
      - An internal bus interchange, optimising the flow of buses servicing the site.  
      - A dedicated Bus parking area, providing storage for site transport when not in service.   
      - A car park to accommodate the vehicles of both visitors and staff.  
      - A designated parking area for Heavy Goods Vehicles (HGVs), providing short-term storage for heavy material deliveries.   
      - Security access tracks that facilitate safe movement for personnel and maintain site security.  
      - Footways and crossings that promote safe, non-motorized movement throughout the facility.  
      
      The scope of work for the area includes all activities necessary to complete the following: site preparation, material deliveries, duct installation routes, the creation of hard surfaces required for the described functions, and the required illumination of the area.  
      
      The following items are excluded from this scope of work:  
      - HXX Pass Office  
      - HAF Search Facility  
      - HUG-1 Security Lane Cabins  
      - HEA & HTR - Old Abbey Substation  
      - HOM-2 - TCA West Potable Water Storage Facility  
      - HUF-1 - Freight Security Building  
      - HAY-2 - TCA Telecoms Bunker  
      
       Tenderers will be required to: 
      • Provide a programme of works matching or improving the suggested Phasing Plan. 
      • To construct the plaza in its entirety, compliant and fit for purpose. 
       • Support the Project in SZC ESG and Social Value Goals",East of England,Sizewell C Limited,50000000,70000000,1
35440 - WEST GATE SCHOOL,as per tender,"North East,North West,Yorkshire and The Humber,East Midlands,West Midlands,East of England,London,South East,South West",Leicester City Council,22,49,1
MIGRATION ADVISORY COMMITTEE HOUSING PROJECT,"The Migration Advisory Committee (MAC) seeks to procure researchers/research teams to fill crucial evidence gaps in the MAC's understanding of the impact of migration on housing in the UK. There are two funding pots for Projects 1 and 2. 

The first is for a literature review, with a ceiling of £15,000, with which we intend to award one project. This literature review covers the causal link between migration and housing (prices, rent etc.) in relevant developed economies and implications for the UK context.

The second is for a more open project(s) exploring the impact of migration on house prices in the UK, with a ceiling of £60,000, with which we intend to award up to 2 projects. Bidders may bid for projects in one or both pots.

How the project is delivered is to be determined by the successful bidders. The bids themselves should outline how the bidder aims to deliver the project. We have an obligation to be open, fair, and transparent with the funding but have no preferred analytical method to be adopted for the research proposed and will evaluate each bid according to its merits based on the evaluation criteria stated within the Instruction to Bidders. The research must be completed by March 2026","United Kingdom,Isle of Man,Channel Islands,British Oversea Territories,Europe,Rest of the World",Home Office,15000,60000,1
CA15620 - Prospere Learning Academy - Water Monitoring Services,"Prospere Learning Academy wish to appoint a Water Monitoring Services supplier

To access this competition: 

Registered:
Login to https://suppliers.multiquote.com and view the opportunity CA15620.

Not registered:
Visit https://suppliers.multiquote.com then register and quote CA15620 as the reason for registration. 

 Any queries please contact MultiQuote on 0151 482 9230.",Any region,Prospere Learning Trust,0,0,0
Berkeley (Marybrook Street),Groundworks to form permeable parking spaces together with associated planters.,England,Stroud District Council,45000,45000,0
Brimscombe Port Mill Ground Floor WC Refurbishment & Salthouse External Maintenance,Brimscombe Port Mil - The refurbishment of the communal WC accommodation and the external repair of the Grade II detached Salt House building.,Any region,Stroud District Council,55000,55000,0
PARKSIDE HOUSE NEW BUILD DEVELOPMENT 25,"AWARD of the following 

The Authority is seeking experienced and skilled suppliers to enter into a Contract for the former Parkside House and build new properties for the Contract, Parkside House New Build Development 25 (the Works).  The Location of the works is at Elston Street East, Wallsend, Tyne & Wear, NE28 8QU.  Their will be a site open date on 20 November from 12 noon for those who have expressed an interest via the NEPO Portal in advance. Please confirm your attendance within the messaging section of the OPEN Portal, providing ANY attendees names and contact numbers in case of any issues on the day.

The Project (Contract) will include  the erection of two storey detached flat complexes to provide 8 residential properties.

The Works are anticipated to commence 1st April 25 and the Authority will confirm to the successful Contractor the final start date.  

The successfully awarded Contractor will be required to work together with North Tyneside Council (the Authority) to drive improvements and support the aims and ambitions of the Contract.

Tenderers must pay attention to the requirements as set out in the full Tender pack. The Specification, Contract Documents and  Preambles are all within the Tender pack and Tenderers must pay attention to these and  ALL the other Tender Documents.

Responses will only be accepted by return via the OPEN electronic tendering Portal and by the deadline stated, the Tender documents are available to download immediately after registering an interest.  The link to the Procurement in OPEN is provided further below, unregistered suppliers will be re-directed to a registration page.",North East,NORTH TYNESIDE COUNCIL,1499000,1500000,1
Framework for the Provision of Multifunctional Devices,"HEART are looking to appoint a single Supplier who will demonstrate technical competency, best Value for Money and to provide all requirements in relation to both new and refurbished Multifunctional Devices (MFDs), including the supply, installation, maintenance, and repairs of the machines, including any spare parts required, to HEART and other Customers on a National basis. It is anticipated that these services will be promoted and accessed by the Education Sector and to other small to medium sized Public Sector organisations but for the avoidance of doubt, is open to any Public Sector Contracting Authority.

The single Supplier for this Framework must also be able to provide Digital Transformation Solutions which can work seamlessly alongside the devices, including but not limited to, Print Management Cloud Services, and Automated Invoice Processing.

The Supplier must be able to offer the option to purchase, and option to lease, both new and refurbished Multifunctional Devices.

The Supplier must be able to provide Consumables for the devices, and offer devices from a minimum of two different manufacturers, to ensure the Customer is provided with optionality and unbiased recommendations.

The Supplier is expected to prioritise the providence of quality, sustainability, and social value in all operations.
",Any region,HEART ACADEMIES TRUST,1,139000000,1
Darley Street Market - External Retractable Awnings,"The Council requires a suitably qualified and experienced Provider for the design, supply and fitting of three retractable awnings fitted to the building frontage facing the Darley Street Market square",Any region,EU SUPPLY LIMITED,0,25000,1
NEYPPC Pharmacy - Unlicensed Imported Medicines 2025,"Framework Agreement for the Supply of Unlicensed Imported Medicines Services and Products to Trusts within the North of England with the inclusion of mini competitions and/or direct awards

(The service may incorporate an over labelling and translation service, where required. These products are medicines that do not have a marketing authorisation in the UK. The medicines, however, do hold a licence in an approved country outside of the UK)",United Kingdom,North East & Yorkshire NHS Pharmaceutical Purchasing Consortium (Hosted by the Contracting Authority Leeds Teaching Hospitals NHS Trust),15416541,15416541,0
CA15594 - Prospere Learning Trust - Water Monitoring Services,"Appointment of a supplier of water monitoring services

To access this competition: 

Registered:
Login to https://suppliers.multiquote.com and view the opportunity CA15594.

Not registered:
Visit https://suppliers.multiquote.com then register and quote CA15594 as the reason for registration. 

 Any queries please contact MultiQuote on 0151 482 9230.",Any region,Prospere Learning Trust,0,0,0
Bed management,"North Cumbria Integrated Care NHS Foundation Trust are conducting a Pre-Market Engagement (PME) to enable the Trust to build the foundation for a successful procurement renewal.

In this engagement we hope to gather an insight into the market as well as giving yourselves as specialist providers an opportunity to both inform the specification and to get ready for demand. 

Current Bed Management Model/Specification:-

PPM Inventory List attached within Atamis portal
On Site Repairs
Staff on site within the contracted hours
Decontamination
Clinical Support
Dolphin FPR
Bariatric FPR",United Kingdom,North Cumbria Integrated Care NHS Foundation Trust,250000,250000,0
EEAST - Lift Maintenance (250124),"The East of England Ambulance Service NHS Trust is seeking a Supplier to provide reactive and preventative maintenance service to their Lifts, across the estate as and when required by the Estates Department. 

The contract will run initially from 20th May 2025 until 19th May 2028 with the option to extend for up to two (2) further periods of up to twelve (12) months. Services will be required as detailed below and called off as and when required. The Trust does not guarantee any level of business or exclusivity arising from this opportunity.",England,East of England Ambulance Service NHS Trust,30000,30000,0
TEST - DO NOT RESPOND - CFOR APR 2025 - LIVE,"Lorem ipsum dolor sit amet consectetur adipiscing elit. Quisque faucibus ex sapien vitae pellentesque sem placerat. In id cursus mi pretium tellus duis convallis. Tempus leo eu aenean sed diam urna tempor. Pulvinar vivamus fringilla lacus nec metus bibendum egestas. Iaculis massa nisl malesuada lacinia integer nunc posuere. Ut hendrerit semper vel class aptent taciti sociosqu. Ad litora torquent per conubia nostra inceptos himenaeos.
      
      Lorem ipsum dolor sit amet consectetur adipiscing elit. Quisque faucibus ex sapien vitae pellentesque sem placerat. In id cursus mi pretium tellus duis convallis. Tempus leo eu aenean sed diam urna tempor. Pulvinar vivamus fringilla lacus nec metus bibendum egestas. Iaculis massa nisl malesuada lacinia integer nunc posuere. Ut hendrerit semper vel class aptent taciti sociosqu. Ad litora torquent per conubia nostra inceptos himenaeos.",London,BiP Solutions Ltd,1000000,2500000,1
6292 - Day Opportunities for Adults with Learning Disabilities - Lot 1 Carlton Centre Lot 2 Smerdon Centre,Day Opportunities for Adults with Learning Disabilities - Lot 1 Carlton Centre Lot 2 Smerdon Centre,England,London Borough of Bexley,4560000,4560000,0
TEST - DO NOT RESPOND - CFOR APR 2025,TEST - DO NOT RESPOND - CFOR APR 2025,London,BiP Solutions Ltd,100000,150000,1
Scanning Support,GMC currently uses 4 Kodak Scanners alongside Kofax systems for delivering a central workflow system for scanning.  A pre-production environment is used for testing changes or upgrades prior to release into our production environment. Both environments are currently running Kofax Capture v11.,North West,General Medical Council (GMC),0,50000,1
BBV Sublot 4 - HSST1020 - Architectural Lighting System,"The scope of work includes detailed engineering based on the existing design provided by the appointed designer, with the specified product being OCS Units - Outdoor Miniatur-Strahler OS5. The package covers the supply, installation, testing, and commissioning of the architectural lighting system, ensuring compliance with industry standards, sustainability requirements, and HS2 design objectives.
      Additionally, ongoing maintenance will be provided to ensure long-term performance. The scope also includes the procurement, erection, and energization of two cassette assemblies (one top chord and one parapet cluster) for a preliminary on-site mock-up test. This test will allow the design team to evaluate lighting distribution, intensity, and colour rendering. The installation will include colour change/selection and dimming functionality, enabling up to 10 different static lighting colour selections, with final colours confirmed at a later stage.","North East,West Midlands,London,Yorkshire and The Humber,East Midlands,East of England,North West,South West",Balfour Beatty VINCI JV HS2,1000000,2500000,1
Marketing Manchester ITT Provision of Agency Services related to Delivery of a Influencer Campaign,"Marketing Manchester (MM), part of the Growth Company (GC), is seeking to appoint an Agency to deliver an influencer campaign to promote Manchester to leisure travellers from the United Arab Emirates and Saudi Arabia. 

The purpose of this project is to appoint an agency to deliver an influencer campaign to promote Manchester as a vibrant leisure destination to travellers from the United Arab Emirates and Saudi Arabia. Social media is a top source of inspiration for audiences across both markets and an influencer campaign would serve to inspire travel to the city, generating overnight stays during the summer months.  

Key Objectives 

1. Raise awareness of Manchester as a leisure visitor destination to a target audience of Experience Seekers* within the target markets of the United Arab Emirates and Saudi Arabia. 
 
2. Showcase the experience of visiting Manchester through compelling and engaging content, which will be delivered across the right channels to reach our target audiences and amplified to further extend reach and impact.

3. Inspire travel to the city this summer (July - September 2025) and encourage travellers to book now. 

4. Generate an incremental uplift in overnight stays in ABID accommodation properties over the summer months (July - September 2025).

5. Drive economic impact for the Greater Manchester region.

* Further information on the Experience Seeker audience: Experience Seekers want to squeeze the most out of every second on holiday. Willing to spend on travel and experiences, they are passionate about travel, they love discovering new, unique, exciting experiences that they can share with others. They want to get ahead of the curve and be seen as a trailblazer, seeking out immersive experiences that allow them to see, taste and discover unique activities, places and people. They are 25-44yrs old. They use social media and online research tools heavily, both of which have significantly influence on their travel planning.

To apply for this tender opportunity, please register as a supplier on the Panacea Supplier Platform at the following web address: https://app.panacea-software.com/growth

Once you have accessed the site, to view the opportunity you need to navigate to 'Register Interest', click the 'Participate' Button, then navigate to 'My Questionnaires' where you will be able to download the documents. Your tender submission must be made on the Panacea Portal.  Please ensure ALL the relevant tender documents are included within the 'Response' section of the Questionnaire.  You can add these individually or utilise a Zip folder to submit your response.  Once uploaded, this will allow you to 'Submit' your bid.  

The documents contain instructions and information for your tender, including specification of requirements, and the key assessment and evaluation criteria that will be used to assess offers.
 
The deadline for submission of the required documents is at 17:00pm on Tuesday 15th April 2025.
",North West,The Growth Company,40000,0,0
"Pine Grove Enterprise Park Solar PV and ASHP, Wolfe Tractor Shed Solar PV","The Framework Agreement is divided into three separate Lots:-

Lot 1 - Pine Grove Enterprise Park Design, Supply and Installation of Solar PV System, connection and commissioning with associated equipment. Operations and Maintenance of Solar PV system. 5 years and 10 years.

Lot 2 - Pine Grove Enterprise Park Design, Supply and Installation of Air source heat pump (ASHP). Operations and Maintenance of Air Source Heat Pump (ASHP) and associated equipment for 5 years and 10 years.

Lot 3 - Wolfe Tractor Shed Design, Supply and Installation of Solar PV System, connection and commissioning with associated equipment. Operations and Solar PV system and associated equipment for 5 years and 10 years.",,Ovesco Energy Service Company,150000,200000,1
GB-Middlesbrough: Electrical Periodic Test and Inspection of Fixed Wiring Installations,Electrical Periodic Test and Inspection of Fixed Wiring Installations,North East,Teesside University,100000,500000,1
SGH - Fire Alarm Maintenance,"Fire Alarm Maintenance ,weekly testing and monitoring.
https://atamis-1928.my.site.com/s/Welcome",United Kingdom,St Georges University Hospital NHS Trust (SWLPP),0,0,0
PBT Venues,The service will be used to provide PBT venues,Rest of the World,British Council,75000,110000,1
Leach Pottery Capital Programme - Museum and Gallery Interpretation Design Contract,"*CLARIFICATIONS CLOSED*

The Leach Pottery, founded in 1920 by artist potters Bernard Leach and Shoji Hamada in St Ives (Cornwall), is the home of British studio ceramics.

From 2024 to 2026, it is transforming. We are looking for an innovative and sensitive museum interpretation and exhibition designer to help bring our world- renowned studio museum and working pottery to life.
You will develop an equitable interpretive design for the Leach Pottery redevelopment project, working with the Interpretation Lead, staﬀ and community members alongside interpretation ﬁt-out contractors to deliver a new and enhanced visitor experience across museum, commercial, studio, and learning spaces on site.

We work with diverse audiences and are focused on our local communities, from multigenerational families and adult learners to practicing potters. We welcome visitors from across the country and the globe. We will be open to all, supporting our audiences to be inspired, nurtured, and enriched by the Leach Pottery and its historic legacy while bringing clay to life.

This is part of a £9.6m redevelopment project funded by National Lottery Heritage Fund, St Ives Town Deal and Arts Council MEND programmes. A new Learning and Production Centre, and renovated, repaired and repurposed museum buildings will bring our facilities in line with our programmes and enduring reputation.

The attached PDF includes the design brief, timelines, and details on how to apply. This is a unique, once-in-a-generation opportunity.
Could you help us get it right?

The closing date is Midday on Monday, 7th April 2025
The contract appointment date is Friday, 9th May 2025
This contract runs from May 2025 to November 2026.",,BERNARD LEACH (ST IVES) TRUST LIMITED,75000,80000,1
WP4110 - Evaluation Consultancy as part of Our Heritage: Walsall Community Heritage Fund Programme,"Walsall Council is seeking a high-quality provider to undertake an expert evaluation of: Our Heritage: Walsall Community Heritage Fund (1st April 2025 - 30th September 2028).  
      
      Supported by the National Lottery Heritage Fund in 2025 Walsall Council received a £249,840 grant to deliver the Our Heritage Programme. Central to the project is the upscale of crowdfunding and engagement programmes that will enable heritage organisations to access funding, forge partnerships/supporter networks, and build resilience. 15-20 groups over 4 cohorts are expected to benefit, promoting innovation to champion Walsall's underrepresented heritage. 12 participatory grant making opportunities will be available to further enhance community voice in decision-making.
      
      Alongside this, the programme includes refreshment of the Heritage Action Plan, to guide discussions, set direction and identify sector needs over a 5-year period and beyond. The aim of the first, 2021-2026, strategy was to place heritage at the heart of Walsall's future, protecting what exists whilst nurturing sustainability and identifying opportunities to unlock its full value.
      
      The project vision is to ensure that heritage is better managed through a new Plan, integrated into Walsall's overall vision and transformation, meeting the needs of a diverse local population who are proud to live, work and visit Walsall.",Any region,Walsall Council e-Tendering,0,0,0
GB-Plumley: OPA T758 PFD Plumley Oil Extraction design Requirement,"OPA T758 Plumley, Cheshire, Design of Oil extraction project",North West,Oil and Pipelines Agency,50000,100000,1
RA350042 - Vehicle ramps for Chichester College,"To access this competition: \r
 \r
  login to https://suppliers.multiquote.com and view the opportunity RA350042. Not registered on MultiQuote - visit https://suppliers.multiquote.com then register and quote RA350042 as the reason for registration. Any queries please contact MultiQuote on 0151 482 9230.",Any region,Chichester College Group,0,0,0
Mersey Tidal Power Project - Front-End Engineering Design Services (FEED Services) - Phase 4,"Liverpool City Region Combined Authority (LCRCA) is looking to progress a Front-End Engineering Design Services (FEED Services) Contract to further develop the Mersey Tidal Power Project (Project).
The Specification details the scope of the FEED Services, across a combination of project, commercial and technical aspects to enable a full technoeconomic development study of all aspects of the Project.
The FEED Services contract is to be performed as part of the Phase 4a Development activity on the Project, and in parallel with the Development Consent Order (DCO) Consenting activity, (performed by others)
The FEED Services contract will improve the specification of the scope of works through multi-discipline outline design and deliver a comprehensive approach to future contracting of the detail engineering and construction including a full cost estimate and schedule based on the configuration, scope, method and approach to Phase 5 Engineering and Phases 6-9 Construction, Testing and Commissioning.
The Specification is to be read in conjunction with other documents identified in the Tender Return.
It is important that the Tenderer (Consultant) recognises the breadth and depth of activity within the FEED Services Contract scope and is able to evidence that the extent of work is within their competence and capability.
",North West,Liverpool City Region Combined Authority (LCRCA),4000000,4000000,0
Sewage Treatment Plant Maintenance,"The aim of this tender is to appoint a service provider to carry out cyclical maintenance to our portfolio of Sewage Treatment Plants including;
-Carrying out servicing and inspection of each site as per attached schedule and providing a detailed report.
-Carrying out Annual Desludges of each site as per attached schedule and provide photographic evidence of these desludges.
-Taking meter readings (including photographs of these readings) at each site visit.
-To provide quotations for works identified during cyclical maintenance and complete these works as and when instructed by Connexus.
-To provide emergency attendance on site if required.
-To install an alarm monitoring system to each site that will send a text alert to your company if the plant is down due for reasons such as pump failure, high / low level alarm or power failure for example and then attend call outs from these system alerts.",West Midlands,Connexus Homes Limited,60000,144000,1
Invitation to Tender for the provision of  Interpretation Specialist & Content Development for Hereford Museum and Art Gallery Redevelopment Project,"Herefordshire Council is seeking an experienced Interpretation Specialist & Content Developer to collaborate with Herefordshire Museum Service, Mather & Co. (Appointed Specialist Museum and Art Gallery Designers), and the wider multi-disciplinary design team to develop and deliver high-quality interpretation across the museum's galleries and exhibition spaces",West Midlands,Herefordshire Council,45000,45000,0
CA15584 - Coleg-y-Cymoedd Measured Terms,"Coleg-y-Cymoedd Provision of Measured Terms Tender

To access this competition: 

Registered:
Login to https://suppliers.multiquote.com and view the opportunity CA15584.

Not registered:
Visit https://suppliers.multiquote.com then register and quote CA15584 as the reason for registration. 

 Any queries please contact MultiQuote on 0151 482 9230.",Any region,Coleg y Cymoedd,0,0,0
